{
  "id": "syn-f3-flyash-limit",
  "mode": "evaluate",
  "source": "SYNTHETIC: hand-computed example, not a real plant design",
  "synthetic": true,
  "ruleset_mode": "ACI",
  "request": {
    "fc_mpa": 45,
    "basis": "cube",
    "exposure": ["F3"],
    "slump_mm": 100,
    "nmas_mm": 19,
    "pumpable": false,
    "air_pct": 5.0
  },
  "materials": [
    {
      "id": "cem",
      "category": "cement",
      "sg": 3.15,
      "c3a_pct": 7.5,
      "price_jod_per_kg": 0.075
    },
    {
      "id": "sand",
      "category": "fine_agg",
      "sg_ssd": 2.6,
      "absorption_pct": 1.5,
      "chlorides_pct": 0.01,
      "passing_pct": {
        "9.5": 100,
        "4.75": 98,
        "2.36": 80,
        "1.18": 55,
        "0.6": 35,
        "0.3": 15,
        "0.15": 5
      },
      "price_jod_per_kg": 0.008
    },
    {
      "id": "coarse",
      "category": "coarse_agg",
      "sg_ssd": 2.65,
      "absorption_pct": 1.0,
      "chlorides_pct": 0.005,
      "passing_pct": {
        "25": 100,
        "19": 95,
        "12.5": 40,
        "9.5": 15,
        "4.75": 3,
        "2.36": 0
      },
      "price_jod_per_kg": 0.007
    },
    {
      "id": "water",
      "category": "water",
      "sg": 1.0,
      "sg_confirmed": true,
      "chloride_mg_l": 200,
      "price_jod_per_kg": 0.0005
    },
    {
      "id": "fa",
      "category": "scm",
      "scm_type": "fly_ash",
      "sg": 2.2,
      "price_jod_per_kg": 0.03
    }
  ],
  "proportions_kg_per_m3": {
    "cem": 280,
    "fa": 120,
    "water": 160,
    "sand": 760,
    "coarse": 939
  },
  "expected": {
    "wcm": 0.4,
    "volume_m3": 1.0000816583835452,
    "cost_jod_per_m3": "37.333",
    "compliance": {
      "max_wcm": "pass",
      "min_fc": "pass",
      "scm.max.fly_ash_pozzolan_pct": "fail",
      "scm.max.total_pct": "pass",
      "scm.max.fly_ash_silica_fume_pct": "pass",
      "air": "pass",
      "yield": "pass"
    },
    "verdict": "fail",
    "fcr_mpa": 43.3,
    "tolerance": {
      "volume": 0.002,
      "wcm": 0.001,
      "cost": 0.001
    }
  }
}
