{
  "id": "syn-project-override-both",
  "mode": "evaluate",
  "source": "SYNTHETIC: hand-computed example, not a real plant design",
  "synthetic": true,
  "ruleset_mode": "BOTH",
  "request": {
    "fc_mpa": 30,
    "basis": "cylinder",
    "exposure": ["F0"],
    "slump_mm": 100,
    "nmas_mm": 19,
    "pumpable": true,
    "air_pct": 2.0
  },
  "project_overrides": [
    {
      "requirement": "max_wcm",
      "value": 0.45,
      "kind": "limit_max",
      "units": "ratio",
      "clause_ref": "Project spec \u00a74.2"
    }
  ],
  "materials": [
    {
      "id": "cem",
      "category": "cement",
      "sg": 3.15,
      "c3a_pct": 7.5,
      "price_jod_per_kg": 0.075
    },
    {
      "id": "sand",
      "category": "fine_agg",
      "sg_ssd": 2.6,
      "absorption_pct": 1.5,
      "chlorides_pct": 0.01,
      "passing_pct": {
        "9.5": 100,
        "4.75": 98,
        "2.36": 80,
        "1.18": 55,
        "0.6": 35,
        "0.3": 15,
        "0.15": 5
      },
      "price_jod_per_kg": 0.008
    },
    {
      "id": "coarse",
      "category": "coarse_agg",
      "sg_ssd": 2.65,
      "absorption_pct": 1.0,
      "chlorides_pct": 0.005,
      "passing_pct": {
        "25": 100,
        "19": 95,
        "12.5": 40,
        "9.5": 15,
        "4.75": 3,
        "2.36": 0
      },
      "price_jod_per_kg": 0.007
    },
    {
      "id": "water",
      "category": "water",
      "sg": 1.0,
      "sg_confirmed": true,
      "chloride_mg_l": 200,
      "price_jod_per_kg": 0.0005
    }
  ],
  "proportions_kg_per_m3": {
    "cem": 350,
    "water": 175,
    "sand": 780,
    "coarse": 1050
  },
  "expected": {
    "wcm": 0.5,
    "volume_m3": 1.0023375262054508,
    "cost_jod_per_m3": "39.928",
    "compliance": {
      "max_wcm": "fail",
      "min_fc": "pass",
      "yield": "pass"
    },
    "verdict": "fail",
    "fcr_mpa": 38.3,
    "tolerance": {
      "volume": 0.002,
      "wcm": 0.001,
      "cost": 0.001
    }
  }
}
